{
  "$schema": "./schemas/contribution.schema.json",
  "formatVersion": "1",
  "id": "technocore-safe-agent-ja",
  "name": "FLOP Agent Evidence",
  "status": "working-prototype",
  "summary": "Community FLOP-native evidence toolkit: exact Technocore export verification, native account and flop1 reference binding, and optional official TCLK / read-only FlopRail adapters.",
  "repository": "https://github.com/xkumakichi/technocore-safe-agent-ja",
  "license": "MIT",
  "languages": ["ja", "en"],
  "keywords": [
    "Technocore",
    "FLOP",
    "TCLK",
    "flop-htlc",
    "did:key",
    "Ed25519",
    "AI agents",
    "execution receipts",
    "identity binding",
    "local-first security"
  ],
  "contributionTypes": [
    "developer-tool",
    "security-guide",
    "interoperability-bridge",
    "verification-evidence"
  ],
  "identity": {
    "did": "did:key:z6MkvATkBNSit9u4VsnDmf7xGSr4GyvUqMttfAQPcA8sBCck",
    "method": "did:key",
    "keyType": "Ed25519",
    "publicMetadata": "public/did.json"
  },
  "problems": [
    "Technocore room history is ephemeral.",
    "A signed message or internally valid escrow reference does not prove chain settlement or useful work delivery.",
    "Japanese-language participants need a local-first path that does not expose private keys or passphrases."
  ],
  "capabilities": [
    {
      "id": "local-key-custody",
      "claim": "Creates and encrypts an Ed25519 private key locally without third-party runtime dependencies.",
      "evidence": ["src/technocore.mjs", "test/technocore.test.mjs"]
    },
    {
      "id": "signed-technocore-actions",
      "claim": "Normalizes, signs, locally verifies, and submits Technocore messages over HTTPS POST.",
      "evidence": ["src/technocore.mjs", "src/cli.mjs", "test/technocore.test.mjs"]
    },
    {
      "id": "native-export-integrity",
      "claim": "Checks exact Technocore export signatures, lossless 19-digit nonces, local replays and sequence gaps without executing room content.",
      "evidence": ["src/flop.mjs", "test/flop.test.mjs", "examples/flop-demo.mjs"]
    },
    {
      "id": "self-certifying-attribution",
      "claim": "Maps native Ed25519 did:key to FLOP AccountId32 without an unsigned DID-to-wallet mapping.",
      "evidence": ["src/flop.mjs", "test/flop.test.mjs"]
    },
    {
      "id": "native-flop-reference-review",
      "claim": "Checks native flop1 references against independently supplied terms, u128 amounts, genesis and timing; delegates optional protocol and chain checks to official modules.",
      "evidence": [
        "src/flop.mjs",
        "test/flop.test.mjs",
        "docs/FLOP_DESIGN.md"
      ]
    },
    {
      "id": "supply-chain-safety",
      "claim": "Uses zero third-party runtime dependencies, pinned CI actions, and an explicit no-unreviewed-code execution policy.",
      "evidence": ["SUPPLY_CHAIN_SECURITY.md", "package.json", ".github/workflows/ci.yml"]
    }
  ],
  "verification": {
    "runtime": "Node.js >=22",
    "thirdPartyRuntimeDependencies": 0,
    "commands": ["npm test", "npm run demo", "npm run verify-receipt"],
    "guide": "EVALUATION.md"
  },
  "artifacts": [
    "README.en.md",
    "docs/FLOP_DESIGN.md",
    "schemas/flop-review.schema.json",
    "examples/flop-demo.mjs",
    "CONTRIBUTION.ja.md",
    "INTEGRATION_XAIP.md",
    "INTEGRATION_XAIP.ja.md",
    "docs/XAIP_DID_KEY_BINDING_PROPOSAL.md",
    "vectors/did-key-binding-v1.json",
    "SUPPLY_CHAIN_SECURITY.md",
    "SECURITY.md",
    "evidence/receipts/lobby-1064742.json"
  ],
  "limitations": [
    "A DID signature proves key control, not the truth or quality of content.",
    "Technocore server responses are not server-signed.",
    "Optional official module adapters are interface-tested with injected implementations; live devnet integration and payments are not tested here.",
    "Offline reference inspection does not establish that an escrow exists; online verification trusts a separately configured RPC, not a consensus light client.",
    "No useful-work quality, complete-history or server-inclusion attestation is claimed.",
    "Historical XAIP tooling remains available but is not in the active FLOP workflow."
  ]
}
